{
  "$schema": "https://json-schema.org/draft/2020-12/schema",
  "$id": "https://daily-it-podcast.local/contracts/manuscript.schema.json",
  "title": "Manuscript",
  "description": "Google Drive 上の {episodeId}.json。TTS が読み上げる原稿そのものを入れる SSoT。Playback は同じ本文を表示・再生制御に使う。",
  "type": "object",
  "additionalProperties": false,
  "required": ["episodeId", "date", "title", "durationSec", "body"],
  "properties": {
    "episodeId": {
      "type": "string",
      "description": "エピソード対応キー。ファイル名 stem（{episodeId}.mp3 / {episodeId}.json）と同一。不透明でよい。",
      "minLength": 1
    },
    "date": {
      "type": "string",
      "description": "表示用日付。Asia/Tokyo で暦日化したうえで YYYY-MM-DD。",
      "pattern": "^[0-9]{4}-[0-9]{2}-[0-9]{2}$"
    },
    "title": {
      "type": "string",
      "minLength": 1
    },
    "durationSec": {
      "type": "number",
      "description": "エピソード音声の合計尺（秒）。",
      "minimum": 0
    },
    "body": {
      "type": "object",
      "additionalProperties": false,
      "required": ["opening", "topics", "ending"],
      "properties": {
        "opening": {
          "type": "object",
          "additionalProperties": false,
          "required": ["text", "startSec"],
          "properties": {
            "text": {
              "type": "string",
              "description": "導入の朗読全文。定型挨拶（OpeningGreeting）と intro をこの順で連結した、TTS が読み上げる原稿そのもの。"
            },
            "startSec": {
              "type": "number",
              "description": "オープニング（導入）の音声上の開始位置（秒）。先頭 segment なので構造上つねに 0。シーク用。",
              "minimum": 0
            }
          }
        },
        "topics": {
          "type": "array",
          "minItems": 1,
          "items": {
            "type": "object",
            "additionalProperties": false,
            "required": ["title", "preface", "detail", "startSec"],
            "properties": {
              "title": {
                "type": "string",
                "minLength": 1
              },
              "preface": {
                "type": "string",
                "description": "トピック別前置き原稿。"
              },
              "detail": {
                "type": "string",
                "description": "トピック別詳細原稿。"
              },
              "startSec": {
                "type": "number",
                "description": "当該トピックの音声上の開始位置（秒）。シーク用。",
                "minimum": 0
              }
            }
          }
        },
        "ending": {
          "type": "object",
          "additionalProperties": false,
          "required": ["text", "startSec"],
          "properties": {
            "text": {
              "type": "string",
              "description": "締めの朗読全文。endingSummary と定型締め（ClosingFarewell）をこの順で連結した、TTS が読み上げる原稿そのもの。"
            },
            "startSec": {
              "type": "number",
              "description": "エンディング（まとめ）の音声上の開始位置（秒）。シーク用。",
              "minimum": 0
            }
          }
        }
      }
    }
  }
}
