{"episodeId":"8ff4177b-26fe-4036-ab7b-d2a4e9e7639d","date":"2026-09-04","title":"GPT-6 Astra公開と主要AI同時障害、エンジニア向け今週のIT動向","durationSec":518.5600000000001,"body":{"opening":{"text":"おはようございます。2026年9月4日のITニュースをお伝えします。\n\n\n今日はHacker Newsを中心に、大型言語モデル、インフラ、セキュリティ、開発手法の話をまとめます。OpenAIがGPT-6 Astraを公開しベンチマーク論争が続く一方、ChatGPTやClaude、Grokが同日に停止しました。加えて本人確認サービスの漏えい、コーディングエージェントのツール選好、ドメイン廃止問題まで幅広く取り上げます。ソースに書かれた事実だけを丁寧に整理していきます。","startSec":0},"topics":[{"title":"GPT-6 Astraとベンチマーク論争","preface":"まず最大の話題はOpenAIの新モデルGPT-6 Astraです。数学やコーディング、PC操作で高いスコアを報告していますが、ベンチマークの見方やAGIと呼べるかどうかで議論が続いています。何が発表され、何がまだ分からないのかを整理します。","detail":"OpenAIはGPT-6 Astraを一部組織向けに公開しました。自社のSystem Cardではサイバーセキュリティ能力が初めて最高評価のCriticalに達したとされ、数学やコーディング、PC操作など多くのベンチマークでFableやOpusを上回ると主張しています。ARC-AGI-3では専用ハーネスを使い高得点を記録しましたが、HNではスコアカードの見せ方が誤解を招くと指摘されています。GPT-5.6 SolはResponses APIハーネスなら約30%と推定される一方、表では7.8%と表示されており、ハーネス次第で数字が大きく変わるという問題です。Epoch AIによるとErdos問題68問のうちAstraが解いたのは2問で、全試行に22万ドル超の計算コストがかかったとも報じられています。Cholletの枠組みでは、広いベンチマークをカバーする能力向上と、本当に新しいことを効率よく学ぶ能力は別物だという指摘もあります。Artificial Analysisのインテリジェンス指数ではAstraはOpusに及ばないという評価もあり、OpenAI自身もその点に触れています。利用者が期待するのは、曖昧な指示を一発で決め打ちせず、適度に質問する協調的な挙動だという声も多く、月200ドル級の高額プラン限定という提供形態も話題になっています。","startSec":38.04},{"title":"主要AIサービスの同時停止","preface":"9月3日にはOpenAI、Anthropic、xAIの各サービスが相次いで障害を起こしました。単なる偶然なのか、共通基盤の問題なのか、利用者の乗り換えが二次障害を招いたのか。エンジニアが押さえるべきポイントを見ていきます。","detail":"Ask HNのスレッドによると、ChatGPT、Claude、Grokが同日に利用不能になり、各社のステータスページで障害が記録されました。Cloudflare、Azure、AWS、Google Cloudでも同時刻付近にエラー報告が増えたため、共通の下請けインフラが原因ではないかという推測が出ています。別の説明として、ユーザーが障害中のサービスから他社へ一斉に移ることで、次のサービスが過負荷になり連鎖的に落ちたという見方もあります。xAIはMemphisの計算センターで障害が起きたと謝罪しています。開発者にとっての教訓は、ChatGPTやClaudeを単一の依存先にすると、数時間単位で作業が止まるリスクがあるという点です。同日にK2 Horizonなどオープンモデルの話題もあり、閉源APIに全面依存しない選択肢の価値が改めて議論されました。冗長化やローカル推論、複数プロバイダの併用は、趣味の範囲を超えた運用設計の話になりつつあります。","startSec":142.84},{"title":"本人確認会社のID漏えい事件","preface":"セキュリティの話題では、ID本人確認を代行する企業がハッキングされ、スキャンされた身分証のデータが一年以上リアルタイムで流出していた疑いが報じられました。KYCを外部に任せる設計のリスクを整理します。","detail":"TechdirtやBrian Krebsの記事がHNで参照されています。ある本人確認会社がスキャンした身分証画像について、ハッカーが一年以上にわたりライブフィードのように閲覧できていた可能性が指摘されています。HNでは、民間の第三者に本人確認を任せるより政府主導のデジタルウォレットの方が望ましいという意見や、政府が企業に同等の対応を求める一方で自らは計画を示さないという皮肉なコメントも見られます。エンジニア向けの論点は、外部KYC SaaSに個人データを預けるアーキテクチャの単一障害点化です。漏えいが起きても利用者が代替IDを簡単に再発行できないため、影響は長期化しやすいと指摘されています。カリフォルニアではDMVが提供データを販売して収益を上げているという話も出ており、個人情報をどこに置くかは技術選定以上にガバナンスの問題です。自社サービスで年齢確認や本人確認を組み込む場合、保存期間、暗号化、アクセス監査、ベンダー選定基準を設計段階から明文化する必要があります。","startSec":221.8},{"title":"コーディングエージェントはgrepを選ぶ","preface":"開発ツールの話では、エージェントがLSPよりgrepやripgrepを好む理由と、約1万7千セッションを計測したツール選好調査が注目を集めています。AI時代のコード探索の実態を見ていきます。","detail":"AgentConnectの記事とHNコメントでは、Claude Codeなどのエージェントが高機能なLSPよりgrepを頻繁に使う現象が議論されています。grepは環境に常にあり挙動が安定し、LSPは設定が壊れやすくエージェントの訓練データにもgrepの方が多いという説が出ています。Armatureの調査は約1万7千セッションを計測し、Claude CodeはWeb検索をほとんど使わない一方Codexはほぼ常に検索する、エージェント同士のツール選択は一致より不一致の方が多い、LangChainやSupabaseなどは言及されても選ばれにくい、といった結果を公開しています。別スレッドではNolan Lawsonの記事が引用され、Reactが学習データに過剰に含まれるためエージェント時代にはReactへ回帰する圧力が強まると指摘されています。CursorやVigetがSolidやLitからReactへ移行した例も話題です。学生向けの示唆は、エディタの補完よりリポジトリ全体を素早く検索する習慣と、フレームワーク選定がAIの出力傾向に影響されるという点です。MCPはTredictやLinear連携など本番利用例も増えており、CLIやAPIの代替として会話型UIにツールを載せるパターンが定着しつつあります。","startSec":310.6},{"title":"Verisignによる.name廃止問題","preface":"インフラの話として、Verisignが.nameドメインの第三レベル登録を終了させる方針が批判を呼んでいます。第二レベルは存続するが第三レベルは失効する点と、借り物の識別子に依存する設計の危うさを整理します。","detail":"Neil Fraserの記事とHN、Lobstersの議論によると、Verisignは.nameの第三レベルドメイン、例えばjoe.smith.nameの登録を打ち切り、対応するsmith.nameを解放する方針を示しました。第二レベルのdvt.nameのように直接所有するドメインは対象外です。ICANNの使命である安定したインターネット識別子の運用に反するとして、新規登録停止と既存契約の尊重、移行期間の確保を求める声が多く、LobstersではPublic Suffix Listとの非互換性から段階的廃止自体は理解できるという意見もあります。エンジニアへの教訓は、ドメインは永続的な所有物ではなくリース資産だという点です。IoTのレビューで証明書をドメインから切り離した事例や、メールアドレスをオンラインアイデンティティの根に据える危険性が議論されています。自社サービスの恒久URL、OAuthリダイレクト、Webhook、メール認証は、レジストラやTLDポリシー変更で突然無効化され得ます。カスタムドメイン利用時は移行計画と、ユーザー通知可能な連絡手段の二重化を前提に設計することが推奨されています。","startSec":404.96000000000004}],"ending":{"text":"本日はGPT-6 Astraの公開とベンチマーク論争、主要AIの同時障害、本人確認サービスの漏えい、コーディングエージェントのツール選好、.nameドメイン廃止を取り上げました。共通するのは、外部サービスへの依存が性能やコストだけでなく可用性とセキュリティにも直結するという点です。詳細は各リンクの一次情報で確認してください。\n\n\n以上、2026年9月4日のITニュースでした。","startSec":487.92}}}